"crid","summary","home_invasions"
"1058955","The complainant alleges that the accused officer refused to provide her with police report and provided her neighbor with her personal information without her consent. The complainant states that she was. involved in a traffic incident with her neighbor on 09 December 2012. The complainant alleges that that the accused officer that responded to the call tefused to provide her with a police report and told her to let her neighbor go and file the report. The complainant states that her neighbor wanted to file charges against her and the accused officer told her in order to avoid jail time, you would have to press charges against him. The complainant alleges that on 10 December 2012, she went into the 24th District Station to file a report and the accused officer refused to provide her with a police report again. The complainant alleges that later that evening, Officer Dvignan, contacted her from the 24th District Station and informed her that her neighbor was there to file a police report and needed to verify that her information was correct. The complainant alleges that one of the accused officers provided her neighbor with her personal information without her consent. Reference: RD-","0"
"1056669","The reporting party, who did not witness the incident, alleges that several unknown officers entered her home without a warrant or permission.","1"
"1055483","The complainant alleges that the accused officers arrested him without justification. The complainant alleges that the accused officers searched his residence without justification. The complainant alleges that the accused officers arrested him without justification. The complainant alleges that the accused officers searched his residence without justification. The complainant alleges that the accused officers arrested him without justification. The complainant alleges that the accused officers searched his residence without justification. The complainant alleges that the accused officers arrested him without justification. The complainant alleges that the accused officers searched his residence without justification. The complainant alleges that the accused officers arrested him without justification. The complainant alleges that the accused officers searched his residence without justification. The complainant alleges that the accused officers arrested him without justification. The complainant alleges that the accused officers searched his residence without justification. The complainant alleges that the accused officers arrested him without justification. The complainant alleges that the accused officers searched his residence without justification. The complainant alleges that the accused officers arrested him without justification. The complainant alleges that the accused officers searched his residence without justification.","1"
"1068673","The complainant alleges that during the execution of a search warrant, several unknown white and Hispanic plainclothes officers entered her home without permission and falsely arrested the victim.","1"
"1041451","In an incident involving two on-duty CPD Officers (Officer A and Complainant/Officer B), it was alleged that Officer A directed profanities and/or derogatory remarks via telephone conversation and text messages to the Complainant/Officer B. It was further alleged that Officer A threatened the Complainant/Officer B via text messages and misused departmental equipment to direct profanities and/or derogatory statements towards the Complainant/ Officer B.","0"
"1062008","under walking in the traffic.","0"
"1049299","The reporting party alleges that the accused entered, searched and ransacked her residence without justification. The reporting party further alleges that the accused was derespectful towards her mom in that they ordered her to sign a consent to search form. The reporting party allegs that the accused falsely arrested her nephew,","1"
"1055105","The complainant alleges that the accused officer was rude and yelled and used profane language towards him. The complainant alleges that the accused officer handcuffed him without justification. The complainant alleges that the accused officer was rude and yelled and used profane language towards him. The complainant alleges that the accused officer handcuffed him without justification. The complainant alleges that the accused officer was rude and yelled and used profane language towards him. The complainant alleges that the accused officer handcuffed him without justification. The complainant alleges that the accused officer was rude and yelled and used profane language towards him. The complainant alleges that the accused officer handcuffed him without justification. The complainant alleges that the accused officer was rude and yelled and used profane language towards him. The complainant alleges that the accused officer handcuffed him without justification. The complainant alleges that the accused officer grabbed his arms and searched him without justification. The complainant alleges that the accused officer pointed his weapon at him and his. a","0"
"1056213","The reporting party alleges that the accused, who is assigned to his case (HV- Aggravated Assault), was rude and unprofessional and purposely intimidated him, in that he threatened to arrest him for filing a false police report. The reporting party alleges that the accused stated, """"You filed a false police report, | will lock you up, you got arrested for filing a false police report, she didn't hit you with a bat, | don't see any scratched on you, I'm going to talk to the female and see what she has to say"""" The reporting party further alleges that accused failed to allow him to sign the affidavit regarding his case.","0"
"1059548","The reporting party alleged that the accused executed a search warrant for her apartment. However, the name on the search warrant was a former tenant who lived on the first floor.","1"
"1064449","The reporting party alleged that the accused officer failed to properly secure the subject, allowing the subject to jump out of the squad car and escape.","0"
"1074158","Confidential","0"
"1023617","On February 4, 2009, a complaint was registered with the Independent Police Review Authority (IPRA), regarding an incident that occurred in the 2nd District on February 4, 2009 involving one on-duty Chicago Police Department (CPD) Sergeant (Sergeant A) and seven on-duty CPD Officers (Officers B through H). It was alleged that Sergeant A conducted an improper search; used improper force against Victim A; used improper force against Victim B; used improper force against Victim C; used improper force against Victim D; used improper force against Victim E; directed profanities at Victim A; directed profanities at Victim D; unnecessarily displayed a weapon; threatened to arrest Victim A without basis; engaged in improper verbal action against Victim A; submitted a false report; made a false statement to IPRA; disobeyed two Department Special Orders regarding searching premises; and that his overall actions were contrary to the stated policy, goals, rules, regulations, orders and directives of the Department. It was alleged that Officer B conducted an improper search; used improper force against Victim A; used improper force against Victim B; used improper force against Victim C; used improper force against Victim D; used improper force against Victim E; directed profanities at Victim A; directed profanities at Victim D; unnecessarily pointed a weapon at Victim A; unnecessarily pointed a weapon at Victim B; unnecessarily pointed a weapon at Victim C; unnecessarily pointed a weapon at Victim D; unnecessarily pointed a weapon at Victim E; threatened to arrest Victim A without basis; engaged in improper verbal action against Victim A; submitted a false report; made a false statement to IPRA; and disobeyed two Department Special Orders regarding searching premises. It was alleged that Officer C and G conducted an improper search; used improper force against Victim A; used improper force against Victim B; used improper force against Victim C; used improper force against Victim D; used improper force against Victim E; directed profanities at Victim A; directed profanities at Victim D; unnecessarily displayed a weapon; threatened to arrest Victim A without basis; engaged in improper verbal action against Victim A; submitted a false report; and made a false statement to IPRA. It was alleged that Officer D and Officer F conducted an improper search; used improper force against Victim A; used improper force against Victim B; used improper force against Victim C; used improper force against Victim D; used improper force against Victim E; directed profanities at Victim A; directed profanities at Victim D; unnecessarily pointed a weapon at Victim A; unnecessarily pointed a weapon at Victim B; unnecessarily pointed a weapon at Victim C; unnecessarily pointed a weapon at Victim D; unnecessarily pointed a weapon at Victim E; threatened to arrest Victim A without basis; engaged in improper verbal action against Victim A; and made a false statement to IPRA. It was alleged that Officer E conducted an improper search; used improper force against Victim A; used improper force against Victim B; used improper force against Victim C; used improper force against Victim D; used improper force against Victim E; directed profanities at Victim A; directed profanities at Victim D; unnecessarily pointed a weapon at Victim A; unnecessarily pointed a weapon at Victim B; unnecessarily pointed a weapon at Victim C; unnecessarily pointed a weapon at Victim D; unnecessarily pointed a weapon at Victim E; threatened to arrest Victim A without basis; engaged in improper verbal action against Victim A; submitted a false report; and made a false statement to IPRA. It was alleged that Officer H conducted an improper search; used improper force against Victim A; used improper force against Victim B; used improper force against Victim C; used improper force against Victim D; used improper force against Victim E; directed profanities at Victim A; directed profanities at Victim D; unnecessarily pointed a weapon at Victim A; unnecessarily pointed a weapon at Victim B; unnecessarily pointed a weapon at Victim C; unnecessarily pointed a weapon at Victim D; unnecessarily pointed a weapon at Victim E; threatened to arrest Victim A without basis; and engaged in improper verbal action against Victim A. IPRAs investigation consisted of statements by the accused members, complainants and witnesses, court records, audio transmissions, GPS records, police reports and records. IPRA recommended a finding of UNFOUNDED for the allegations that Sergeant A conducted an improper search; used improper force against Victim A; used improper force against Victim B; used improper force against Victim C; used improper force against Victim D; used improper force against Victim E; directed profanities at Victim A; directed profanities at Victim D; unnecessarily displayed a weapon; threatened to arrest Victim A without basis; and engaged in improper verbal action against Victim A. IPRA recommended to SUSTAIN the allegations that Sergeant A submitted a false report; made a false statement to IPRA; disobeyed two Department Special Orders regarding searching premises; and that his overall actions were contrary to the stated policy, goals, rules, regulations, orders and directives of the Department. IPRA recommended a finding of UNFOUNDED for the allegations that Officer B used improper force against Victim A and used improper force against Victim C. IPRA recommended a finding of NOT SUSTAINED for the allegation that Officer B used improper force against Victim E. IPRA recommended to SUSTAIN allegations that Officer B conducted an improper search; used improper force against Victim B; used improper force against Victim D; directed profanities at Victim A; directed profanities at Victim D; unnecessarily pointed a weapon at Victim A; unnecessarily pointed a weapon at Victim B; unnecessarily pointed a weapon at Victim C; unnecessarily pointed a weapon at Victim D; unnecessarily pointed a weapon at Victim E; threatened to arrest Victim A without basis; engaged in improper verbal action against Victim A; submitted a false report; made a false statement to IPRA; and disobeyed two Department Special Orders regarding searching premises. IPRA recommended to SUSTAIN allegations that Officer C conducted an improper search and made a false statement to IPRA. IPRA recommended a finding of UNFOUNDED for the allegations that Officer C used improper force against Victim A; used improper force against Victim B; used improper force against Victim C; used improper force against Victim D; used improper force against Victim E; directed profanities at Victim A; directed profanities at Victim D; unnecessarily displayed a weapon; threatened to arrest Victim A without basis; engaged in improper verbal action against Victim A; and submitted a false report. IPRA recommended to SUSTAIN allegations that Officer D conducted an improper search and made a false statement to IPRA. IPRA recommended a finding of UNFOUNDED for the allegations that Officer D used improper force against Victim A; used improper force against Victim B; used improper force against Victim C; used improper force against Victim D; directed profanities at Victim A; directed profanities at Victim D; unnecessarily pointed a weapon at Victim A; unnecessarily pointed a weapon at Victim B; unnecessarily pointed a weapon at Victim C; unnecessarily pointed a weapon at Victim D; unnecessarily pointed a weapon at Victim E; threatened to arrest Victim A without basis; and engaged in improper verbal action against Victim A. IPRA recommended a finding of NOT SUSTAINED for the allegation that Officer D used improper force against Victim E. IPRA recommended to SUSTAIN allegations that Officer E conducted an improper search; submitted a false report; and made a false statement to IPRA. IPRA recommended a finding of UNFOUNDED for the allegations that Officer E used improper force against Victim A; used improper force against Victim B; used improper force against Victim C; used improper force against Victim D; used improper force against Victim E; directed profanities at Victim A; directed profanities at Victim D; unnecessarily pointed a weapon at Victim A; unnecessarily pointed a weapon at Victim B; unnecessarily pointed a weapon at Victim C; unnecessarily pointed a weapon at Victim D; unnecessarily pointed a weapon at Victim E; threatened to arrest Victim A without basis; and engaged in improper verbal action against Victim A. IPRA recommended to SUSTAIN allegations that Officer F conducted an improper search and made a false statement to IPRA. IPRA recommended a finding of UNFOUNDED for the allegations that Officer F used improper force against Victim A; used improper force against Victim B; used improper force against Victim C; used improper force against Victim D; used improper force against Victim E; directed profanities at Victim A; directed profanities at Victim D; unnecessarily pointed a weapon at Victim A; unnecessarily pointed a weapon at Victim B; unnecessarily pointed a weapon at Victim C; unnecessarily pointed a weapon at Victim D; unnecessarily pointed a weapon at Victim E; threatened to arrest Victim A without basis; and engaged in improper verbal action against Victim A. IPRA recommended to SUSTAIN allegations that Officer G conducted an improper search; used improper force against Victim C; unnecessarily displayed a weapon; threatened to arrest Victim A without basis; engaged in improper verbal action against Victim A; submitted a false report; and made a false statement to IPRA. IPRA recommended a finding of UNFOUNDED for the allegations that Officer G used improper force against Victim A; used improper force against Victim B; used improper force against Victim D; used improper force against Victim E; directed profanities at Victim A; and directed profanities at Victim D. IPRA recommended a finding of UNFOUNDED for all allegations against Officer H. IPRA recommended separation from the department for Sergeant A and Officers B, C, D, E, F, and G.","1"
"1066542","passengers resulting The reporting party uniformed officer to assist her and report. The that the officer of paper with an ritten on it. The that she had Police Records dates and times and the records personnel the traffic accident","0"
"1062161","The victims alleges that their residence was illegally searched without a warrant.","1"
"1063014","Itis alleged by Sergeant Timothy Wolf #1333 that Sergeant Ray Ramirez #976 received a written order, Notice of Indebtedness form referencing Employee Resource Order on 21 MAY 13 and failed to come into compliance within 30 days ot being notified of his indebtedness to the City of Chicago.","0"
"1057967","The complainant alleged that the accused officers entered her residence and searched it without a warrant or permission. The complainant alleged that the accused officers have entered and searched her residence without a warrant or permission on previous occassions approximately three months ago.","1"
"1056012","The reporting party alleges that the arresting officers falsely arrested the victim(grandson)regarding an attempt robbery. The reporting party alleges that she was able to speak with the citizen who allegedly accused the victim and was informed by the citizen that he never participated in selecting the victim as an offender and neither were there papers signed by the","0"
"1056165","a ting from the residence and failed to inventory or return the ring It is further alleged by the complainant that, the accused officers removed","1"
"1052512","The reporting party witness alleges that he and family members called the police regarding the landlord allowing a Cook County Sheriff, into the victim&#8217;s, place of residence for no apparent reason. The reporting party alleges that several uniformed officers failed to listen to the victims' side of the story, in that they failed to arrest the subject, who had fled from the apartment, when the officers arrived on the scene. The reporting party alleges that the officers failed to arrest the subject, who was still on the scene. The reporting party further alleges that the officers stated, """"We will handle it, hed#8217;s a Cook County Sheriff.8#8221;","1"
"1062369","uniformed officers refused to of the story. The reporting two male white uniformed arrested him for battery. The alleges that he requested for pain in his left reporting party alleges that rude and unprofessional the fuck up, you're not","0"
"1049208","The reporting party stated that the accused entered her place of business and arrested an unknown male/black for selling illegal dvds. The renortina partv alleges that the victim, mmented on the arrest, accused grabbed the ba car seat which causeu i wian uin i @ble. The     reporting party further alleges that the accused failed to give his name and star number upon request.","0"
"1049889","The complainant alleged that her uncle, PO Paul Major, engaged her ina verbal altercation during which he slammed her to the floor, placed his knees on her chest and bangged her head to the floor.","0"
"1017419","On June 16, 2008, a complaint was registered with the Independent Police Review Authority (IPRA), regarding multiple incidents that started on June 2008 involving one off-duty Chicago Police Department (CPD) Officer (Officer A) and one on-duty CPD Sergeant (Sergeant B). It was alleged that Officer A verbally abused complainant; physically maltreated complainant; threatened to shoot complainant; displayed his weapon without justification; engaged in conduct by his overall actions which brought discredit upon the Department; engaged in conduct which brought discredit upon the Department by his overall actions when he encountered the complainant by chance a month after the initial incident; engaged in conduct which brought discredit upon the Department when he had contact with a witness to a Complaint Register investigation; engaged in conduct which brought discredit upon the Department when he drove past a witnesss home; and provided false statements to IPRA. It was alleged that Sergeant B failed to initiate a complete and comprehensive investigation relative to the allegations of misconduct against a Department member; failed to obtain a Complaint Register number after bring made aware of allegations of misconduct against a Department member; and provided a false statements to IPRA. Based upon statements made by the accused members, complainant and witnesses, OEMC transmissions, photographs and reports, IPRA recommended to SUSTAIN the allegations that Officer A verbally abused complainant; physically maltreated complainant; threatened to shoot complainant; displayed his weapon without justification; engaged in conduct by his overall actions which brought discredit upon the Department; engaged in conduct which brought discredit upon the Department by his overall actions when he encountered the complainant by chance a month after the initial incident; engaged in conduct which brought discredit upon the Department when he had contact with a witness to a Complaint Register investigation; and provided false statements to IPRA. IPRA recommended a finding of UNFOUNDED for the allegation that Officer A engaged in conduct which brought discredit upon the Department when he drove past a witnesss home. Further, IPRA recommended to SUSTAIN the allegations that Sergeant B failed to initiate a complete and comprehensive investigation relative to the allegations of misconduct against a Department member; failed to obtain a Complaint Register number after bring made aware of allegations of misconduct against a Department member; and provided a false statements to IPRA. IPRA recommended separation from the department for Officer A and a thirty (30) day suspension for Sergeant B.","0"
"1057081","‘The reporting party alleged that the accused responded to a domestic altercation between him and his Uncle, at which time they handcuffed him, took his car keys and searched his car without permission. One of the officers damaged his glove compartment.","0"
"1063754","The complainant alleged that the accused officer entered his girlfriends apartment without a warrant or permission and searched the premises without justification.","1"
"1067434","The reporting party, lleges that on 10 February 2014 at approximately 1000 hours at in the basement apartment, that accused officer, P.O. Martin OBRECKI, Star 14174. Employee 36265 came to conduct a parole check on her son, 1 that the the accused officer entered her apartment without justification. The reporting party, lalleges that on 10 February 2014 at approximately 1000 hours at n the basement apartment, that accused officer, P.O. Geral ICH, Star 6958, Emplovee 38106 came to conduct a parole check on her son and that the the accused officer entered her apartment without. justification. The reporting party, lleges that on 10 February 2014 at approximately 1000 hours at the basement apartment, that accused officer, P.O. Jose A. ALMANZA, Star 3093, Employee 4689 came to conduct a parole check on her son, and that the the accused officer entered her apartment without Justification. The reporting party, lleges that on 10 February 2014 at approximately 1000 hours at in the basement apartment, that accused officer, fartin KI, Star 14174, Emnlovee 36265 came to conduct a parole check on her son and that the the accused officer searched her apartment without justification. The reporting party, alleges that on 10 February 2014 at approximately 1000 hours at in the basement apartment, that accused officer, P.O. Gerald A. LODWICH, Star 6958, Employee 38106 came to conduct a parole check on her son, jand that the the accused officer searched her apartment without justification. The reporting pa lleges that on 10 February 2014 at approximately 1000 hours at in the basement apartment, that accused offi o_o ’ IZA, Star 3093, Employee 4689 came to conduct a parole check on her son and that the the accused officer searched her apartment without justification The reporting party, illeges that on 10 February 2014 at approximately 1000 hours at’ """"i the basement apartment, that accused officer, F.U. waiun Uereuxl, Star 14174 Employee 36265 came to conduct a parole check on her son, and that the the accused officer damaged property within her apartment. The reporting party, alleges that on 10 February 2014 at approximately 1000 hours at in the basement apartment, that accused officer, eral ICH, Star 6958. Employee 38106 came to conduct a parole check on her son, and that the the accused officer damaged property within her apartment","1"
"1055870","The complainal lleges that during the execution of Search Warrant No. 1200 hours, Member refu b 27 July 2012 between 1130 and the above named Department the warrant upon her request.","1"
"1059403","The complainant states that he is a vat was working 1e complainant aueges that the accused officers refused to provide him with a case report for misplaced or stolen tools that he used in working on her residence.","0"
"1058441","The complainant alleged that the accused officer failed to return his insurance papers during a traffic stop","0"
"1058908","Itis alleged that on 08 December 2012, at approximately 0441 hours, at accused engaged in a physical altercation wit failed to complete a Tactical Response and/or Domestic Battery Report, and ' mber 2012, at approximately 0441 hours, at accused engaged in a physical altercation ‘ical Response and/or Domestic Battery Report, and failed to arres’","0"
"1059618","lleges that on 15 January 2013 at 2030 hours at her residence. chat the accused falsely obtained a warrant to search","1"
