"crid","summary","home_invasions"
"1051629","The reporting party alleges that several Hispanic and white uniformed officers ransarked hie Flderly ill father's/the victim's, basement apartment vrrrous yusunvauai. The reporting party alleges that he inquired as to why the officers searched the victim's place of residence and had him standing outside, with only a sweater on, for a long period of time. The reporting party alleges that the officers directed profanities towards him in an aggressive manner, in that they stated, “Get the fuck inside, out the fucking window, do you want to go to jail, we're going to put you guys in jail, we're coming to get you too and take you to jail, none of your fucking business, | don't believe in God any way, I'm going to hell any way | don't give a fuck!"""" The reporting party further alleges that the officers arrested the victim, without justification. The reporting party alleges that every time he and family members encounters the police that they are harassed for no apparent reason and that this is an on-going situation. The reporting party states that he and his family members are in fear of retaliation and possible bodily harm from the police for filing this complaint.","1"
"1074813","The reporting party alleged that several black male uniformed officers entered her residence with the wrong search warrant and ransacked ner résidence. The repoﬁlng party alleged that when she told the officers that they had the wrong residence they continued to ransack her residence and took her son's van.","1"
"1051086","It is reported that the accused officer improperly informed the watch Commander of all information related to RD# It is reported that the accused Department member improperly informed the watch Com| information related to RD#","0"
"1051991","In an incident involving an on-duty CPD Officer, a Sergeant and the Complainant, it was alleged that the Officer detained the Complainant without justification, transported the Complainant to the hospital against his will, slammed the Complainant against a wall, directed profanities at the Complainant, and released the Complainant without approval from the watch commander. It was further alleged that the Sergeant released the Complainant without approval from the watch commander.","0"
"1059050","THE REPORTING PARTY ALLEGES THAT THE ACCUSED OFFICER REMOVED HIS. STATE OF ILLINOIS IDENTIFICATION CARD AND $60.00 USC AND FAILED TO RETURN SAME. THE REPORTING PARTY STATES THAT DURING A DOMESTIC DISPUTE HIS WIFE, SALLED THE POLICE. HE ALLEGES THAT THE ACCUSED OFFICERS HANDCUFFED HIM. AND DROVE HIM TO 87TH STREET AND THE DAN RYAN, RELEASED HIM AND TOLD HIM NOT TO GO BACK HOME.","0"
"1061956","‘The reporting party alleged that the accused entered and searched her residence without justification, at which time they falsely arrested her son __for robbery.","1"
"1050109","THE REPORTING PARTY ALLEGES THAT THE ACCUSED OFFICER ENTERED AND SEARCHED HER RESIDENCE AND ARRESTED THE VICTIM WITHOUT JUSTIFICATION. THE REPORTING PARTY ALLEGES THAT THE ACCUSED OFFICER ENTERED AND SEARCHED HER RESIDENCE AND ARRESTED THE VICTIM WITHOUT JUSTIFICATION.","1"
"1051447","The reporting party alleges that the accused officer continues to harass her and her family by approaching her home without justification and entering and searching without a warrant or permission.","1"
"1058157","searched him then left the scene.","0"
"1064325","THE REPORTING PARTY STATES THAT SHE WENT TO THE 006TH DISTRICT STATION TO REPORT A TRAFFIC ACCIDENT IN WHICH SHE WAS INVOLVED IN. SHE ALLEGES THAT THE ACCUSED OFFICER WAS RUDE, WOULD NOT LET HER TALK AND GAVE HER INCORRECT INFORMATION. SHE ALSO ALLEGES THAT THE ACCUSED OFFICER THREATENED TO WRITE HER A TICKET. THE REPORTING PARTY STATES THAT SHE WENT TO THE OO06TH DISTRICT STATION TO REPORT A TRAFFIC ACCIDENT IN WHICH SHE WAS INVOLVED IN. SHE ALLEGES THAT THE ACCUSED OFFICER WAS RUDE, IN THAT SHE CONSTANTLY INTERRUPTED HER, WOULD NOT LET HER TALK AND GAVE HER INCORRECT INFORMATION. SHE ALSO ALLEGES THAT THE ACCUSED OFFICER YELLED AT HER.","0"
"1058004","The reporting party alleged that the accused responded to his call regarding a domestic altercation between him and his ex- grrifriend One of the officers was verbally abusive in that he told him to shut the fuck- up The accused filed a domestic battery police report (RD HV[ . however the accused refused to arrest his ex-girifriend, who had maced him The accused threatened to arrest him for no apparent reason","0"
"1030340","On September 21, 2009, a complaint was registered with the Independent Police Review Authority (IPRA), regarding an incident occurring in the 3rd District, on September 21, 2009. It was alleged that an on-duty Chicago Police Department (CPD) officer mishandled his weapon, which resulted in an accidental discharge in the bathroom. Based on reports, IPRA recommended to SUSTAIN the allegation that the accused mishandled his weapon, which resulted in an accidental discharge in the bathroom. Based on a mediation, the violation was noted in the accuseds disciplinary file.","0"
"1066094","on him and his family. alleges that once he accused officer that he was for the police, the left the scene.","0"
"1052147","The reporting party/victim alleged that no supervisor responded to her house after she called 911 several times. The reporting party/victim alleged that the accused officer verbally abused her by calling her a """"fucking bitch” and a """"drunk""""” and did not provide service in that she did not complete a report about a domestic battery and threat involving the reporting party/victim's daughter. NOTE: The accused officer is the same accused officer in Log#1052146. The reporting party/victim's daughter is lives in Indiana. The daughter's boyfriend, who battered threatened the reporting party/victim, is","0"
"1057864","The Reporting Party Victim alleged he was harassed unfairly for sitting inside of his vehicle and profiled as a suspicious looking person for no reason. It was further alleged the accused attempted to verbally provoke the victim, falsely accused him of reaching for a weapon and searched his vehicle without justification.  The Reporting Party Victim alleged he was harassed unfairly for sitting inside of his vehicle and profiled as a suspicious looking person for no reason. It was further alleged the accused attempted to verbally provoke the victim, falsely accused him of reaching for a weapon and searched his vehicle without justification.","0"
"1060411","officers arrived, the officers entered and searched her home without a warrant or permission.","1"
"1061489","of the officers (8 and 10) on the","0"
"1073227","The reporting party alleged that the accused officer searched her residence without permission after she allowed the officers inside. The reporting party also alleged that the accused officer swore at her.","1"
"1017305","On June 12, 2008, a complaint was registered with the Independent Police Review Authority (IPRA), regarding an incident that occurred on June 12, 2008 in the 19th District involving one off-duty Chicago Police Department (CPD) Sergeant (Sergeant A) and two on-duty CPD Officers (Officers B and C) and two Complainants (Complainants A and B). It was alleged that Sergeant A engaged in an unjustified physical and verbal altercation with Complainants A and B; punched Complainant A; punched Complainant B; directed profanities at Complainants A and B; failed to complete a Tactical Response Report regarding the incident; gave a false statement to IPRA during its investigation; and that his overall actions were contrary to the stated policy, goals, rules, regulations, orders and directives of the Department. It was further alleged that Officer B failed to protect his arrestees (Complainants A and B); failed to follow general orders regarding an injured arrestee; failed to report an officers misconduct; and provided a false report to IPRA. It was alleged that Officer C failed to protect her arrestees (Complainants A and B); failed to follow general orders regarding an injured arrestee; and failed to report and officers misconduct. Based upon statements by the accused members, complainants and eyewitnesses, photographs, records, reports, and a video recording, IPRA recommended to SUSTAIN the allegations that Sergeant A engaged in an unjustified physical and verbal altercation with Complainants A and B; punched Complainant A; directed profanities at Complainants A and B; failed to complete a Tactical Response Report regarding the incident; gave a false statement to IPRA during its investigation; and that his overall actions were contrary to the stated policy, goals, rules, regulations, orders and directives of the Department. IPRA recommended a finding of NOT SUSTAINED for the allegation that Sergeant A punched Complainant B. Based upon statements by the accused members, complainants and eyewitnesses, photographs, records, reports, and a video recording, IPRA recommended to SUSTAIN the allegations that Officers B and C failed to protect their arrestees (Complainants A and B) and failed to follow general orders regarding an injured arrestee. IPRA recommended a finding of NOT SUSTAINED for the allegation that Officer B and C failed to report an officers misconduct. Further, IPRA recommended to SUSTAIN the allegation that Officer B provided a false report to IPRA. IPRA recommended separation from the department for Sergeant A, a thirty (30) day suspension for Officer B, and a fifteen (15) day suspension for Officer C.","0"
"1051248","The reporting victim states she went into the 008th District Station to get a case report concerning a traffic accident. The reporting parting victim alleges that the white female accused officer was rude and unprofessional. The complainant alleges that she asked the white male accused officer was there anyone else she could speak with, the accused officer replied, """"We don't have a supervisor, he got fired."""" The complainant alleges that the white male accused officer, told her he did not have a phone number to possibly complain and if she needed one she would have to call “311"""". Case Report#","0"
"1073831","In an incident involving an on-duty CPD Officer, it was alleged that the Officer unintentionally discharged his firearm.","0"
"1059002","without justification.","0"
"1063189","The complainant, who is not involved in a relationship with the accused, alleged that the accused texted her explicit (nude) photographs of herself from his cell phone.","0"
"1067169","THE REPORTING PARTY STATES THAT SHE CALLED THE POLICE FOR ASSISTANCE REGARDING HER 14 YEAR OLD DAUGHTER, WHO IS A KNOWN RUNAWAY AND WHO WAS ATTEMPTING TO RUN AWAY AGAIN. SHE ALLEGES THAT THE ACCUSED OFFICERS TOLD HER THAT THERE WAS NOTHING THAT THEY COULD DO AND ALLOWED HER DAUGHTER TO PACK HER BELONGINGS AND TO LEAVE AGAIN. THE REPORTING PARTY STATES THAT SHE CALLED THE POLICE FOR ASSISTANCE REGARDING HER 14 YEAR OLD DAUGHTER, WHO IS A KNOWN RUNAWAY AND WHO WAS ATTEMPTING TO RUN AWAY AGAIN. SHE ALLEGES THAT THE ACCUSED OFFICERS TOLD HER THAT THERE WAS NOTHING THAT THEY COULD DO AND ALLOWED HER DAUGHTER TO PACK HER BELONGINGS AND TO LEAVE AGAIN.","0"
"1061066","THE ACCUSED ORDER FROM THE AND WAS","0"
"1064130","THE REPORTING PARTY, STEPHANIE WAITS ALLEGES THAT THE ACCUSED OFFICERS BROKE HER DOOR IN, HANDCUFFED HER AND SEARCHED HER RESIDENCE WITHOUT JUSTIFICATION. SHE ALSO ALLEGES THAT THE ACCUSED OFFICERS ARRESTED THE VICTIM, THOUT JUSTIFICATION. THE VICTIM, ADDIE ZOLICOFFER ALLEGES THAT THE ACCUSED OFFICERS THREATENED HER WITH ARREST AND REFERRED TO HERAS A “BITCH” WITHOUT JUSTIFICATION.","1"
"1054969","The reporting party/third party, who did not witness the incident, alleged that the accused officers entered the house without a warrant. savina thev were looking for . looked through the house and failed to identify themselves pronerlv whan r=~uiested by the victim,","1"
"1059176","The reporting party alleges that the accused officer failed to provide her with police services regarding a domestic. The reporting party alleges that the accused officer failed to provide her with police services regarding a domestic.","0"
"1060752","Itis alleged that between 11 MAR 13 at 2100hrs - 12 MAR 13 at 1200hrs at the accused failed to secure his Glock Model 27 Serial numbe 40 caliber semi automatic firearm with 3.5 inch barrel and blue Swe moti","0"
"1063778","white male plainclothes officer removed her watch from her bedroom which was not inventoried or returned.","1"
"1058685","The complainant alleges that upon her boyfriend's, 3 arrest, the accused officer took his keys and entered her residence without a search warrant or permission.","1"
"1052218","The reporting party alleged that the accused responded to a domestic battery, at which time the accused failed to inventory or retum $207.00 U.S.C","0"
"1061236","vas involved in a physical altercation with several indivuduals during which he was physically injured. Mr. alleged that after he got up from the ground he walked up to a marked squad car located in the vicinity and tapped on the window for help and the accused officers failed to assist him in that they did not roll down the window and instead drove away.","0"
"1063874","The complainant alleged that the accused officer damaged her belongings during the execution of a search warrant.","1"
"1067364","Victim alleges that he was falsely arrested for possession of a handgun. Victim alleges that he was falsely arrested for possession of a handgun. Victim alleges that he was falsely arrested for possession of a handgun. Victim alleges that he was falsely arrested for possession of a handgun. Victim alleges that he was falsely arrested for possession of a handgun. Victim alleges that he was falsely arrested for possession of a handgun. Victim alleges that he was falsely arrested for possession of a handgun. Victim alleges that he was falsely arrested for possession of a handgun. Victim alleges that he was falsely arrested for possession of a handgun. Victim alleges that he was falsely arrested for possession of a handgun.","0"
"1050980","The reporting party alleged that the accused sergeant refused to file a complaint when she asked him to do so The reporting party alleged that the accused sergeant entered and searched her home without justification. The reporting party further alleged that the accused sergeant displayed his weapon while he searched","1"
"1067666","The reporting party alleged that she called the accused Detective to check the status of a theft investigation Itis alleged that the accused Detective was tude and unprofessional with his tone of voice and demeanor It Is further alleged that the accused Detective refused to contact the eyewitness to obtain additional information pertaining to the investigation","0"
"1064790","The reporting party alleged that the accused officers raided her apartment while she was not home, caused damage during the raid, and did not leave any paperwork about it. The reporting party believed that the accused officers did not have a warrant.","1"
"1051802","The reporting party alleged that while she was in the backyard, speaking with unknown officers regarding the whereabouts of her son, — other officers entered and searched her residence without justification. The officers told her daughter if she didn't open the door, they would kick in the door and charge her with a felony.","1"
"1052945","The reporting party alleged that the accused pushed her aside and entered her apartment without justification. The accused was verbally abusive in that she stated, """"I'm here to get your boyfriend, until you're fucking evicted.” The accused refused to give her name and star number upon request","1"
"1053502","The reporting party alleges that an unknown male black uniformed officer entered his home without a warrant or permission looking for his stepson M/B 15 Jun 94)","1"
"1055852","The complainant who did not witness the ncident alleges that the accused officers searched her residence without a search warrant looking for her two sons, The complainant alleges that the accused officers damaged her back door","1"
"1058912","a description the was borrowing a the bus.","0"
"1059490","The reporting party ieged that the accused entered and searched her residence without justification. The reporting party IRI oc that the accused damaged the back door.","1"
"1069608","The reporting party that the accused, P.O. Lionel PIPER, Star 14650, Employee Unit 212 kicked in the door to his residence al at 0034 hours on 03 June 2014 The reporting part, , alleges that the accused, Sgt. Gregory SLOYAN, |, Unit 212 kicked in the door to his residence at at 0034 hours on 03 June 2014 The reporting part» ______iigges that the accused, P.O Nicholas RUMAS, Star 12777 ~ A Unit 212 kicked in the door to his residence at 0034 hours on 03 June 2014 The reporting party, leges that the accused, P.O. Lionel PIPER Star 14959. Emninvag , Unit 212 searched his residence at at 0034 hours on 03 June 2014 without a warrant or permission The reporting party lledes that the accused, Sgt Gregory SLOYAN Star 892 Freninyee , Unit 212 searched his residence a at 0034 hours on 03 June 2014 without a warrant or permission. The reporting party, __ alleges that the accused, P.O. Nicholas RUMAS. Star 13731 Fmninvee_ Unit 212 searched his residence 0034 hours on 03 June 2014 without a warrant or permission","1"
"1061085","The reporting party alleges that a black and Hispanic male uniformed officer stopped him under the pretense that his temporary license plate had expired. The reporting party alleges that the black male uniformed officer handcuffed, questioned, and searched him and his vehicle without justification.","0"
"1049735","The reporting party alleges that an unknown male white plainclothes officer entered her home inside of her bedroom without a warrant or permission The reporting party alleges that one of the officers destroyed her property without reason.","1"
"1061907","THE REPORTING PARTY ALLEGES THAT THE ACCUSED OFFICER FAILED TO TOW HIS VEHICLE DURING HIS ARREST.","0"
"1072607","behalf of his client} hours, at| and failed to secure the apartment after the Search Warrant and as a result his personal items were stolen. The Reporting Third Pai behalf of his client] hours, 1e ACCUSE The Reporting Third Party Attorney Jonathan MRAUNAC alleged on hat on 26 March 2013, at 1758 cers ransacked his apartment Attorney Jonathan MRAUNAC alleged on —— that on 26 March 2013, at 1758 the accused officers ransacked his apartment and failed to secure the apartment after the Search Warrant and as a result his personal items were stolen.","1"
"1087579","This investigation originated on November 20, 2017, after Chicago Police Of?cers executed a search warrant at The initial investigation closed at COPA on May 20, 2019. COPA received a letter1 from the Public Safety Of?ce of Inspector General noting the existence of BWC that had not been referenced in original investigation. The lack of the BWC was the basis for one of ?ndings. The following COPA Supplemental Summary report does not repeat information contained in the original summary report, but only includes evidence that substantially changes the ?ndings in the original report.","1"
"1051056","The reporting party alleged that the accused entered and searched her parents residence because of a false report that they had weapons inside","1"
"1052279","The reporting party alleged that the accused illegally searched the victim's apartment without a warrant and without permission Ine sez~ ~skbadannTIRS S ms However the accused searche","1"
"1054607","The reporting party alleges that several unknown white male officers entered her home without a warrant or permission","1"
"1056681","The reporting party/victim alleges that the accused officer and her male partner failed to take enforcement action after she told them a couple threatened her. It is also alleged the officers did not take enforcement action because the couple who threatened her and the officers are hispanic and the reporting party/victim is black.  The reporting party/victim alleges that the accused officer and his female partner failed to take enforcement action after she told them a couple threatened her. It is also alleged the officers did not take enforcement action because the couple who threatened her and the officers are hispanic and the reporting party victim is black.","0"
"1073179","The reporting party alleges, that without justifcation, the accused officers kicked in the front door to her two flat building, kicked in the door to her second floor apartment, and kicked in the back gate to her property","1"
"1074540","The reporting party alleged that the accused officers engaged in a verbal altercation with him in which they called him a """"bitch"""" and a “cocksucker."""" The reporting party further alleged that the accused officers kicked his front door, which caused damage to the door frame and lock. This incident occurred after there was a fire at the building next to the reporting party's residence.","1"
"1049933","The reporting party alleges that she called back and requested to be speak to a supervisor and that an unknown male officer answered. The reporting party alleges that the same officer was rude and unprofessional and that he stated in an aggressive manner, """"You're being rude to me, that the number he gave us, there's nothing we can do about it, hold on!"""" The reporting party alleges that the male officer placed her on hold for a long period of time and that he failed to the call back and he failed to assist her. The reporting party alleges that she received a telephone call from an unknown female officer, who was rude and unprofessional towards her for no apparent reason. The reporting party alleges that the officer stated in an aggressive manner, """"l have your brother, shut up girl!"""" The reporting alleges. that the female officer abruptly disconnected the call","0"
"1057775","The complainant, WHO DID NOT WITNESS THE INCIDENT, alleged that the accused entered the residence and searched it without a warrant or permission, It is also alleged that the accused threatened to arrest the victim without justification.","1"
"1069034","in the neighborhood. The party further alleged that the promised to make the arrest “go away” if he provides the","0"
"1028646","On July 28th, 2009 a complaint was registered with the Independent Police Review Authority (IPRA) regarding an incident involving one on- duty Chicago Police Officer (Officer A), one Chicago Police Sergeant (Sergeant B), and one Chicago Police Lieutenant (Lieutenant C) that occurred on August 6th, 2010 in the 10th District. It was alleged that Officer A asked the Victim if she was a hooker; referred to the Victim in a derogatory manner; slammed the Victims face down onto the floor; placed his knee on the Victims back while handcuffing her; groped the Victim about her body; erased personal data from the Victims cellular phone; and described the Victim using racially biased and offensive language. It was alleged that Sergeant B and Lieutenant C observed and/or had knowledge of misconduct and failed to take necessary actions by initiating a Complaint Log number. Based on statements from the accused Department Members, the Victim and witnesses, Department reports, and photographs, IPRA recommended to NOT SUSTAIN the allegation that Sergeant B and Lieutenant C observed and/or had knowledge of misconduct and failed to take necessary actions by initiating a Complaint Log number. IPRA recommended to UNFOUND the allegations that Officer A slammed the Victims face down onto the floor and groped the Victim about her body. IPRA recommended to NOT SUSTAIN the allegations that Officer A asked the Victim if she was a hooker; referred to the Victim in a derogatory manner; placed his knee on the Victims back while handcuffing her; and erased personal data from the Victims cellular phone. IPRA recommended a finding of SUSTAINED for the allegation that Officer A described the Victim using racially biased and offensive language. IPRA recommended a one (1) day suspension for Officer A.","0"
"1048997","The reporting party alleges that while she was handcuffed, the accused grabbed her left wrist and twisted her arms backwards, causing pain to her left wrist.","0"
"1049219","The complainant who did not witness the incident alleges that the accused officers that responded to his call for police assistance demanded payment from the victim to pay the """"locksmith"""" that arrived on the scene. The complainant who was listening by phone requested to speak to one of the accused officers and was denied The complainant alleges that """"Coope” said to the victim, """"You'll end up paying more money in bond money and threatened to arrest him."""" The complainant alleges that he called a """"desk"""" and spoke with “Sergeant Doyle"""" and informed him of had taken place and the accused officer said, “He couldn't do anything.","0"
"1061796","OFFICER HAS AN INDEBTEDNESS TO THE CITY OF CHICAGO.","0"
"1051617","The complainant alleged that the accused sergeant failed to assisthimin processing a claim against the city. The accused sergeant identified himseff s the supervisor whose team served the warrant while the complainant was not present and stated that his team had served the warrant at the wrong address. Warrant S","1"
"1055267","In an incident involving an off-duty CPD Officer and the Complainant/spouse, it was alleged that the Officer repeatedly struck the Complainant/spouse on the face, restrained the Complainant/spouse by holding her down against the floor, pursued the Complainant/spouse from the residence as she attempted to get away, grabbed the Complainant/spouse about the body, and brought discredit upon the Department in that he was arrested for domestic battery.","0"
