"crid","summary","home_invasions"
"1049892","The reporting party alleges that the accused officer damaged her front door without justification. It is alleged that the accused officer chased and handcuffed without justification. It is further alleged that the accused officer threatened to arrest without justification  The reporting party alleges that the accused officers searched her residence without justification. It is alleged that the accused officers were rude and unprofessional in that they refused to answer any of the victim's questions","1"
"1051467","Three CPD members involved - two unknown on- duty Chicago Police Officers (Unknown Officer A and B) and an on-duty sergeant. It is alleged that Unknown Officer A engaged in unjustified physical contact with Complainant and failed to identify himself. It is alleged that Unknown Officer B entered Complainants residence without permission, unnecessarily displayed his weapon, failed to identify himself, and coerced the Complainant. The Sergeant is alleged to have failed to initiate proper action.","1"
"1056152","The complainant alleged that the accused officers entered and searched the residence without a warrant or permission","1"
"1058725","The complainant alleged that the accused officer stopped them without justification and arrested the witness for driving without a vailid driver's license. The complainant alleged that she and the witness were on their way to the hospital because she is 39 weeks pregnant and she told the officer that she needed to be rushed to the hospital. The complaianant alleged that the accused officer told her, “| don't care what happens to you, it's not my problem,"""" and, """"You can take a taxi cab or call an ambulance,"""" and towed the vehicle. The complainant alleged that the accused officer searched her vehicle without justification. The complainant alleged that the accused officer stopped them without justification and arrested the witness for driving without a vailid driver's license. The complainant alleged that she and the witness were on their way to the hospital because she is 39 weeks pregnant and she told the officer that she needed to be rushed to the hospital. The complaianant alleged that the accused officer told her, “I don't care what happens to you, it's not my problem,"""" and, """"You can take a taxi cab or call an ambulance,"""" and towed the vehicle. The complainant alleged that the accused officer searched her vehicle without justification.","0"
"1062158","The reporting party alleged that the accused entered (with their weapons drawn but not pointed) searched and ransacked her tesidence without justification The female Sergeant told her and her daughter, “Shut the fuck-up Every time we get calls in regards to shots fired, we're coming back in here ","1"
"1068990","Itis alleged that on an unknown date, time and location the Accused took inappropriate pictures of his bodyparts while inside a Department facility. It is alleged that on an unknown date, time and location the Accused took inappropriate pictures of his bodyparts while in Department uniform.","0"
"1071714","THE REPORTING PARTY STATES THAT SHE WAS THE VICTIM OF AN ASSAULT. SHE ALLEGES THAT THE ACCUSED OFFICER REFUSED TO ALLOW HER TO PRESS CHARGES AGAINST THE OFFENDER AND HE FAILED PROVIDE HIS STAR NUMBER UPON HER REQUEST.","0"
"1058489","The reporting party alleged that the accused entered his home and searched the apartment and him without justification","1"
"1054623","The reporting party alleges that the accused searched him, the victims, and his without justification. The reporting party further alleges that the accused was disrespectful by swearing at him and the victims and by threatening to taser them. The reporting party alleges that the accused searched him, the victims, and his without justification. The reporting party further alleges that the accused was disrespectful by swearing at him and the victims and by threatening to taser them. The reporting party alleges that the accused searched him, the victims, and his without justification. The reporting party further alleges that the accused was disrespectful by swearing at him and the victims and by threatening to taser them.","0"
"1054050","The reporting party alleged that the accused stopped him under false pretense that he ran a red light, at which time they ordered him to exit the vehicle. The accused searched him and his vehicle without justification.","0"
"1055601","The reporting party alleges that several plainclothes officers, possbily named “Freeman"""", """"Cortesi"""", and """"Vivas"""", kicked in the front door, displayed a picture of a subject and stated, """"Do you know who him, do you know where he 1s?"""" The reporting party alleges that the officers ransacked i bedroom The reporting party alleges that the officers did not show a search warrant to anyone The reporting party alleges that officers damaged two building entry doors and the apartment front door during therr search The reporting party alleges that officers told her, “He's a grown man, he'll call you later,” when she asked where they were taking her stepfather The reporting party alleges that she asked for the officers’ names and star numbers and the officers stated, """"Screw you, bite me™! The reporting party alleges that the officers arrested the victm without justficaiton The reporting party she has photos on her Samsung Galaxy 2 phone OFFICER #3 WHITE MALE PLAINCLOTHES OFF , SLENDER BUILD, GREEN OR BROWN SHORT SLEEVE SHIRT, BLUE JEANS, BALD 5'07""""-5'08"""" TALL, MID 30'S","1"
"1049206","The reporting party alleges that she called 911 regarding a domestic incident. The reporting party alleges that the accused failed to list her as a victim on a police report | . processed for simple assault. The reporting party alleges that the accused failed to amrest the female subject, (who is the former girlfriend of her current boyfriend) who had sprayed pepper spray in her direction, and who was still on the scene. The reporting party further alleges that the accused officer stated, """"This report is for him."""" The reporting party alleges that she called 911 regarding a domestic incident. The reporting party alleges that the accused failed to list her as a victim on a police report ( ), processed for simple assault. The reporting party further alleges that the accused failed to arrest the female subject (who is the former girlfriend of her current boyfriend), who had sprayed pepper spray in her direction, and who was still on the scene.","0"
"1056635","The reporting party alleged that he was a victim of a domestic battery in that his three brothers had assaulted him. The accused arrived on the scene, refused to file a police report on his behalf and failed to take police action against his brother, who had made several verbal threats toward him. A short time later, he was assaulted again by one of his brothers, at which time the accused falsely arrested him for domestic battery.","0"
"1048130","On September 1, 2011, a complaint was registered with the Independent Police Review Authority (IPRA), regarding an incident that occurred on September 1, 2011 in the 3rd District, involving an on-duty Chicago Police Department (CPD) Sergeant. It was alleged that the accused Sergeant was inattentive to duty in that she accidentally discharged her taser. Based upon a mediation, the accused Sergeant agreed to accept IPRAs finding of SUSTAINED and a Violation Noted.","0"
"1066254","The reporting party alleged that the accused officer lied in order to obtain a search warrant for her residence. The reporting party also alleged that the accused officers also damaged her door, an antique train set, a collection of Barbie dolls, and spoiled her food by throwing it on the floor. Reference Search Warrant","1"
"1061800","‘The reporting party alleged that the accused failed to inventory or return his Illinois state Link card and debit card.","0"
"1005774","On 16 May 2007, a complaint was registered with the Independent Police Review Authority (IPRA, formerly known as the Office of Professional Standards), regarding an incident that occurred in the 14th District, in which a Chicago Police Department officer allegedly kicked and physically mistreated a detainee. Because videotape evidence and witness statements corroborated the allegations, IPRA recommended to SUSTAIN the allegations against the accused. IPRA recommended a thirty (30) day suspension for the accused officer. The partner of the accused failed to report the misconduct, and IPRA recommended to SUSTAIN three counts of violating Rule 6, Disobedience of an order/directive whether written or oral against the partner. IPRA recommended a fifteen (15) day suspension for the partner.","0"
"1049619","The reporting party alleges that the police entered her home without a warrant or permission","1"
"1050083","The reporting party related that he video recorded the accused officers as they arrested an unknown black male. The reporting party alleged that the officers questioned him and deleted the recording from his camera.","0"
"1056051","The complainant alleged that he called for police to have his girlfriend, Connie Williamson arrested for battery against him but the accused officers failed to arrest her RD was generated on the same date but at 1550 hours.","0"
"1057783","lalleges the accused falsely arrested her The complainan| boyfriend th UUW on 03 Oct 2012, 2230 hours at","0"
"1073190","The reporting party alleged that the accused officer directed profanity at the victim by telling her to """"get the fuck out of the house"""" and entered the reporting party's apartment without justification. The reporting party stated that the accused officer appeared to be looking for an unknown person in the apartment building at the time and that he may have completed contact cards for the victim and another individual.","1"
"1062839","to inventory or to her.","0"
"1074255","The Complainant, alleged that on 23 FEB 2015 while at between the hours of 2:15p.m. - 4:30 p.m. the Accused, Officer Darin MASON #13577, assigned to Unit 005 / Detailed to Unit 241, drugged her The Complainant , alleged that on 23 FEB 2015 while at between the hours of 2:15p.m. - 4:30 p.m. the Accused, Officer Darin MASON #13577, assigned to Unit 005 / Detailed to Unit 241, forced her to perform oral sex on him","0"
"1021083","On October 23rd, 2008, a complaint was registered with the Independent Police Review Authority (IPRA) regarding a domestic incident involving an off-duty Chicago Police Officer that occurred on multiple dates in the 9th District. It was alleged that the Officer harassed Complainant A; and left a voicemail message for Complainant A threatening to kill Complainant As boyfriend on August 27th, 2008. It was also alleged that the Officer harassed Complainant A via cell phone between October 11th, 2008 and October 23, 2008. It was alleged that the Officer showed Complainant B a photograph of Complainant As boyfriend and questioned her about him on October 22nd, 2008. It was also alleged that the Officer searched for the name of Complainant As boyfriend without proper authorization and for personal gain on August 8th, 2008. During mediation, Officer B agreed to accept IPRAs finding of SUSTAINED for all allegations and a two (2) day suspension.","0"
"1058549","The reporting party, who is currently on medical. alleged that the accused failed to return his telephone calls which resulted him being on stationary status for three extra days.","0"
"1059738","The reporting party alleged that the accused officers entered and searched her residence without a warrant, permission or justification. The reporting party also alleged that the accused officers questioned her 11-year-old and 8-year-old children without her present.","1"
"1060096","against the female offender who damaged the complainant's windshield and was still on the scene. The complainant also alleged that the accused officers failed to provide her with a police report for the damage to her vehicle and stated words to the effect of “You can call the station to request another unit when you are ready and let them know Beat 823 was here.” The complainant admitted to walking away from the female officer preparing a report for her and went into her apartment. The complainant stated that she walked away because several male police officers had arrived and attempted to enter her apartment in search of her son.","1"
"1042275","In an incident involving two on-duty CPD Officers (Officer A and Field Training Officer (FTO) B), a Complainant/Victim, and another Victim (Victim), it was alleged that Officer A repeatedly struck the Victim about the body, struck the Complainant/Victim in the eye causing the Complainant/Victims head to hit the glass of a restaurant window, placed the Complainant/Victim and the Victim in his police vehicle and drove them around without justification, threatened to drop the Complainant/Victim and the Victim off in a different neighborhood other than where they lived, and failed to complete and submit a field contact card. Also, it is alleged that FTO B failed to complete and submit a field contact card. Finding: Officer A: During mediation, Officer A agreed to accept IPRAs finding of SUSTAINED and a penalty of a Violation Noted for the allegation that he failed to complete and submit a field contact card; NOT SUSTAINED for the allegations that the Officer A repeatedly struck the Victim about the body, struck the Complainant/Victim in the eye causing the Complainant/Victims head to hit the glass of the restaurant window, drove the Complainant/Victim and the Victim around in his police vehicle without justification and threatened to drop the Complainant/Victim and the Victim off in a different neighborhood other than where they lived. FTO B: Based on statements from the accused Officers, the Complainant/Victim and the Victim; and department records, IPRA recommended a finding of SUSTAINED and a penalty of a 1-day Suspension for the allegation that FTO B failed to complete and submit a field contact card.","0"
"1050448","Complainant alleged that on 26 November 2011, the accused failed to file an Assault report on her behalf after she complained that a gang member threatened to kill her. The complaiant further alleged that on 02 December 2011, she returned to the 14th District Station after being threatened a second time and a male officer took her complaint. While at the station, the accused was present and allegedly was unprofessional in that she “intimidated"""" the complainant by giving her “dirty looks.","0"
"1059227","THE REPORTING PARTY ALLEGES THAT THE ACCUSED OFFICER ENTERED AND SEARCHED HER RESIDENCE WITHOUT JUSTIFICATION.","1"
"1067694","The complainat 1920 hours, at int alleges that on 25 February 2014, Chicago, IL 60651, the accused, 7 White Unknown Department Members, allegedly damaged property while searching his residence without justification alleges that on 25 February 2014, The complaina; 1920 hours, at} nt. Chicago, IL 60651, the accused, 7 White Unknown Department Members, allegedly damaged property while searching his residence without justification lleges that on 25 February 2014, The complain: 1920 hours, a ant, Chicago, IL 60651, the accused, 7 White Unknown Department Members, allegedly damaged property while searching his residence without justification alleges that on 25 February 2014, The complain: 1920 hours, a ant, Chicago, IL 60651, the accused, 7 White Unknown Department Members, allegedly damaged property while searching his residence without justification alleges that on 25 February 2014, The complainai 1920 hours, at it, Chicago, IL 60651, the accused, 7 White Unknown Department Members, allegedly damaged property while searching his residence without justification lleges that on 25 February 2014, The complain: 4920 hours, a rant, Chicago, IL 60651, the accused, 7 White Unknown Department Members, allegedly damaged property while searching his residence without justification alleges that on 25 February 2014, The complainai 1920 hours, at it Chicago, IL 60651, the accused, 7 White Unknown Department Members, allegedly damaged property while searching his residence without justification EL siloces that on 25 February 2014, The complainant 1920 hours, af accused, 7 White Unknown Department Members, allegedly damaged property while searching his residence without justification. alleges that on 25 February 2014, The complainar 4920 hours, at int, Chicago, IL 60651, the Chicago, IL 60651, the accused, 7 White Unknown Department Members, allegedly damaged property while searching his residence without justification","1"
"1058978","THE REPORTING PARTY ALLEGES THAT THE ACCUSED SERGEANT ENTERED AND SEARCHED HER RESIDENCE WITHOUT JUSTIFICATION. SHE ALSO ALLEGES THAT THE ACCUSED OFFICER MADE INAPPROPRIATE COMMENTS SUCH AS """"HAVE MORE FUCKING KIDS"""" AND """"DID YOU FINISH SCHOOL."""" THE REPORTING PARTY ALLEGES THAT THE ACCUSED OFFICERS ENTERED AND SEARCHED HER RESIDENCE WITHOUT JUSTIFICATION.","1"
"1063505","The reportingparty/victim alleges unknown police officers; were rude and unprofessional on 12 July 2013 in that they threatened to handcuff him and place him under arrest. The reportingparty/victim alleges unknown police officers;were rude and unprofessional on 12 July 2013 in that they threatened to handcuff him and place him under arrest. The reportingparty/victim alleges unknown police officers;were rude and unprofessional on 12 July 2013 in that they threatened to handcuff him and place him under arrest. The reportingparty/victim alleges unknown police officers; were rude and unprofessional on 12 July 2013 in that they threatened to handcuff him and place him under arrest. The reportingparty/victim alleges unknown police officers;were rude and unprofessional on 12 July 2013 in that they threatened to handcuff him and place him under arrest. The reportingparty/victim alleges unknown police officers;were rude and unprofessional on 12 July 2013 in that they threatened to handcuff him and place him under arrest.","0"
"1065646","THE REPORTING PARTY STATES THAT HE WAS INVOLVED IN A PHYSICAL ALTERCATION WITH A AND THERE WAS A WARRANT FOR HIS ARREST IF HE WAS FOUND ON THE COMPLEX PREMISES. THE REPORTING PARTY STATES THAT HE CALLED THE POLICE AND THE ACCUSED OFFICERS FAILED TO ARRES’","0"
"1056199","The reporting px the accused officer searche: without justification after handcuffs. The reporting party related that the officers had an arrest warrant for Andre Hope but did not have a search warrant.","0"
"1049146","The complainant alleges that the accused entered her ¢ ===~ #k an invalid warrant for a hat was not signed by a judge. The complainant further alleges that the accused failed to provide their names and star numbers upon request and entered her apartment without her permission after she refused them entry. The complainant alleges that the accused refused to provide her with a copy of the invalid warrant. Per the complainant, one unknown man was arrested in her apartment","1"
"1051138","The Reporting Party Victim alleged that the accused entered Ace Restaurant “repeatedly looking at him in a threatening manner, """"taunting” him and loudly stated,""""February 7th!,"""" their scheduled trial date. It was further alleged the accused followed the victim outside, a few doors down to the barber shop,continued to “taunt and harrass"""" the victim and then arrested him without justification. The victim stated he had two other incidents with accused officer. The Reporting stated the unknown accused, attended court in preparation for the trial. It was alleged the unknown accused assisted his partner in arresting the victim without justification.","0"
"1054316","Unknown Police Officers searched her residence without consent. The complainant alleged that she called for a Sergeant the sergeant that arrived was rude and unprofessional in that he directed profanities at her and called her a """"Fat ass."""" The complainant further alleges the sergeant who responded refused to initiate a Complaint Register Number against the police officers who searched her residence without consent.","1"
"1058318","THE REPORTING PARTY ALLEGES THAT THE ACCUSED OFFICER HAS BEEN LYING IN ORDER TO OBTAIN SEARCH WARRANTS. HE/SHE ALLEGES THAT THE ACCUSED OFFICER TAKES DRUG ADDICTS BEFORE JUDGES WITH FABRICATED TESTIMONY TO OBTAIN SEARCH WARRANTS THAT WERE NOT BASED ON, PROBALE CAUSE. HE/SHE FURTHER ALLEGES THAT DURING SEVERAL ARREST AND SEARCH WARRANTS, MONEY AND. JEWELRY HAVE BEEN STOLEN FROM THE CITIZEN'S RESIDENCES. THE REPORTING PARTY ALLEGES THAT THE ACCUSED OFFICER HAS BEEN LYING IN ORDER TO OBTAIN SEARCH WARRANTS. HE/SHE ALLEGES THAT THE ACCUSED OFFICER TAKES DRUG ADDICTS BEFORE JUDGES WITH FABRICATED TESTIMONY TO OBTAIN SEARCH WARRANTS THAT WERE NOT BASED ON, PROBALE CAUSE. HE/SHE FURTHER ALLEGES THAT DURING SEVERAL ARREST AND SEARCH WARRANTS, MONEY AND. JEWELRY HAVE BEEN STOLEN FROM THE CITIZEN'S RESIDENCES.","1"
"1061143","The reporting party alleged the during the execution of a search warrant, the accused officer damaged the front door, a bedroom wall, pantry shelves and a bathroom vanity. Consequently, the landlord ordered him to vacate the apartment and refused to return his security deposit.","1"
"1073806","The Reporting Party Victims alleged that when they went into the 005th District Station to file a report for identity theft, the accused officer was rude and unprofessional and treated them poorly, disrespected them and rolled her eyes at revil","0"
"1076573","On August 6, 2015, at approximately 9:00 pm, at W. Cortland, Subject 1 and his partner, Subject 2, were inside Subject 2?s residence when Officer A, Officer B, Officer C, and Officer entered the residence and arrested Subject 1 and Subject 2. Prior to their arrests, Subject 1 and Subject 2 were involved in an incident at a local convenience store. The store clerk, Civilian 1, refused to sell Subject 2 cigarettes without identification.2 Following Civilian 1?s refusal to sell Subject 2 cigarettes, Subject 2 got into a physical altercation with the store clerk and then both Subject 2 and Subject 1 damaged property inside the store. Subject 1 alleged that his arrest was without justification, and while inside the residence, Officer grabbed Subject 1 and pushed him against the wall. It was further alleged that an unidentified officer damaged Subject 1?s cell phone by slamming it against the kitchen counter. After being placed under arrest, Subject 1 and Subject 2 were transported to the District Station where an unidentified officer called Subject 1 a ?faggot? and repeatedly turned the lights of the processing room occupied by Subject 1 off and on. The Civilian Office of Police Accountability investigated Subject 1?s allegations and determined there was insufficient evidence to prove or disprove the allegation that Subject 1 was arrested without justification. Additionally, COPA determined there was insufficient evidence to prove or disprove the allegations that Officer grabbed Subject 1 and pushed him against a wall; that an unidentified officer damaged Subject 1?s cell phone; and that an unidentified officer called Subject 1 a ?faggot? and repeatedly turned the lights of a processing room occupied by Subject 1 off and on. Accordingly, all the allegations are not sustained.","1"
"1058087","The reporting party alleged that the accused officers harassed him, handcuffed him and entered and searched his residence without justification","1"
"312270","On April 12, 2006, a complaint was registered with the Independent Police Review Authority (IPRA f/k/a the Office of Professional Standards), regarding an incident that occurred on April 12, 2006 in the 24th District. It was alleged that an off-duty Chicago Police Department (CPD) officer engaged in an unjustified physical altercation; was in possession of a firearm while impaired; and made a false statement to IPRA. Based upon statements by the accused member, complainant and witnesses, photographs, OEMC transmissions, and reports, IPRA recommended a finding of NOT SUSTAINED for allegations that the officer possessed a firearm while impaired. Further, IPRA recommended to SUSTAIN allegations that the officer engaged in an unjustified physical altercation and made a false statement to IPRA. IPRA recommended a thirty (30) day suspension for the accused officer.","0"
"1058767","In an incident involving an off-duty CPD Officer and a Complainant, it was alleged that Officer engaged in a physical and verbal altercation with the Complainant, bit Complainants arm, and several counts of failing to secure his firearm, including when the Complainant retrieved his firearm from an unlocked motorcycle compartment, when the Complainant attempted to hide his firearm, and when a witness retrieved the firearm from the ground during the altercation between the Officer and Complainant.","0"
"1061426","It is alleged that the accused owes $200 to the Department of Revenue.","0"
"1058239","It is reported that the accused officers were inattentative to duty in that, they failed to prepare a case report documenting the significant injuries of the two victims, and failed to secure medical assistance for both victims. It is reported that the accused officers were inattentative to duty in that, they failed to prepare a case report documenting the significant injuries of the two victims, and failed to secure medical assistance for both victims.","0"
