"crid","summary","home_invasions"
"1052304","Itis reported that accused is being ordered to the Random Drug Testing Unit on 04Mar12 at 0900hr in order to take a Just Cause urinalysis test. It is reported that due to the results of the two previous specimen samples, per Sgt. Skol #1378, is requesting a CL number for Just Cause for the accused to do so.","0"
"1052953","The complainant alleges on 11 February 2012 at Ave, two officers forced him to disrobe in front of two females. The complainant alleges on 11 February 2012 at Ave, two officers forced him to disrobe until he was fully disrobed and performed an intrusional body cavity search. The complainant alleges on 11 February 2012 I Ave, two officers forced him to disrobe in front of two females. The complainant alleges on 11 February 2012 at Ave, two officers forced him to disrobe until he was fully disrobed and performed an intrusional body cavity search.","0"
"1056226","The reporting party alleged that the accused officers entered and searched her room without a warrant, permission or justification. The reporting party also alleged that the accused officers arrested the victim for possession of 40 bags of heroine but the victim only had about 20 bags of cocaine.","1"
"1061394","It is reported that the accused officer has an indebtedness to the City of of Chicago.","0"
"1050767","The reporting party alleges that the accused entered and searched his residence without justification. The accused falsely arrested him for criminal trespass to land.","1"
"1053188","The reporting party alleged that the accused entered his apartment, with their weapons drawn, without his permission.","1"
"1055120","The reporting party alleged that the accused harassed him in that he came out of his assigned District and issued him two false citations, which were later non-suited at the 016th District","0"
"1033714","Complainant and Civilian 1 were involved in a physical altercation outside of Restaurant A. A woman claimed that the assailants were Chicago police officers. Officers A, B, and C responded to the scene. They did not search for witnesses, did not properly document the encounter, and did not render aid.","0"
"1061417","in that one of the students was by a vehicle.","0"
"1021926","On November 22, 2008, a complaint was registered with the Independent Police Review Authority (IPRA), regarding an incident occurring in the 6th District, on November 21, 2008. It was alleged that an off-duty Chicago Police Department (CPD) officer struck the complainant during a domestic altercation; damaged the complainants cell phone by smashing it to prevent her from calling the police; and damaged the bathroom door by punching it with his fist. Based on statements from the accused officer, reports, audio recordings, and photographs, IPRA recommended to SUSTAIN the allegations that the accused struck the complainant during a domestic altercation; and smashed the complainants cell phone to prevent her from calling the police. Further, IPRA recommended a finding of NOT SUSTAINED for the allegation that the accused damaged the bathroom door by punching it with his fist. IPRA recommended a three (3) day suspension for the accused officer.","1"
"1058673","officers entered her home without warrant or permission.","1"
"1067883","The witness alleges that she was present when an unknown white male plainclothes officer arrested the victim(Son) and planted drugs on him.","0"
"1069550","In an incident involving an on-duty CPD Officer, it was alleged that the Officer unintentionally discharged his weapon while trying to re-holster it.","0"
"1071699","The complainant alleges that she has been constantly harassed by the police in that on the above date and time, her family was harassed by the police while they entered and searched her home without a warrant permission","1"
"1006654","On 17 June 2007, a complaint was registered with the Independent Police Review Authority (IPRA, f/k/a The Office of Professional Standards) regarding incidents occurring outside of the City of Chicago limits. It was alleged that an off-duty Chicago Police Department officer on various occasions harassed a complainant via the telephone and was intoxicated. Based on the recordings of the derogatory messages left by the accused officer and admissions made by the accused officer, IPRA recommended to SUSTAIN the allegation that he harassed a complainant via the telephone. Because there was no corroborating evidence to support the allegation that the accused officer was intoxicated, IPRA recommended to NOT SUSTAIN this allegation. IPRA recommended a three (3) day suspension for the accused officer.","0"
"1051828","The reporting party alleged that the accused harassed her and family members, in that they entered and searched their apartment without justification. The accused alleged falsely arrested her brother for drugs because he refused to give them a name of a drug dealer.","1"
"1074701","The complainant alleges that several unknown officers entered and searched her residence without a warrant or permission","1"
"1053724","THE REPORTING PARTY STATES THAT SHE WAS HARASSED BY HER LANDLORD, HER LANDLORD'S DAUGHTER KICKED HER DOOR AND SHE CALLED THE POLICE. SHE ALLEGES THAT ONE OF THE ACCUSED OFFICERS THAT RESPONDED WAS RUDE AND TOLD HER TO TELL HIMIN § MINUTES WHY HE WAS THERE","0"
"1066583","The complainant alleged that the accused Department member failed to respond to her call about a burglary and property damage.","0"
"1062997","The reporting party alleges the accused officer ordered him to exit his vehicle, """"slammed"""" him against the car and twisted his arms behind his back, It is further alleged that the accused officer inventoried $2700.00 that belonged to the victim without justification.","0"
"1063628","THE REPORTING PARTY ALLEGES THAT THE ACCUSED OFFICER ENTERED AND SEARCHED HER RESIDENCE WITHOUT JUSTIFICATION. THE REPORTING PARTY ALLEGES THAT THE ACCUSED OFFICER ENTERED AND SEARCHED HER RESIDENCE WITHOUT JUSTIFICATION.","1"
"1070194","THE REPORTING PARTY STATES THAT HE WAS THE VICTIM OF A SHOOTING ON JUNE 29, 2014. HE STATES THAT THE ACCUSED OFFICER HAS A PERSONAL RELATIONSHIP WITH A FRIEND OF THE OFFENDER. HE ALLEGES THAT THE ACCUSED OFFICER INTERFERED IN THE INVESTIGATION IN THAT SHE INFORMED THE OFFENDER'S FRIEND THAT HE IS A SUSPECT, CAUSING HIM TO GO INTO HIDING. Ri","0"
"1002752","On January 16, 2007, a complaint was registered with the Independent Police Review Authority (IPRA f/k/a the Office of Professional Standards), regarding an incident that occurred on January 16, 2007 in the 4th District involving two on-duty Chicago Police Department (CPD) Officers (Officers A and B). It was alleged that Officer A physically abused Victim A; struck Victim B about the body; placed her (Officer A) hand on her (Officer A) gun and verbally threatened Victim B; left a threatening voice message on Victim Bs cellular telephone; pushed Victim C to the floor; kicked Victim C; threw flower plants and vases at Victim B; left her assigned job without authorization; and left her assigned district without authorization. It was alleged that Officer B left his assigned job without authorization and left his assigned district without authorization. Based upon statements by the accused members, one of the victims, one of the witnesses, a voice recording, 911 recordings, and reports, IPRA recommended a finding of UNFOUNDED for the allegation that Officer A physically abused Victim A. IPRA recommended a finding of NOT SUSTAINED for allegations that Officer A struck Victim B about the body; placed her (Officer A) hand on her (Officer A) gun and verbally threatened Victim B; pushed Victim C to the floor; kicked Victim C; and threw flower plants and vases at Victim B. Further, IPRA recommended to SUSTAIN the allegations that Officer A left a threatening voice message on Victim Bs cellular telephone; left her assigned job without authorization; and left her assigned district without authorization. Further, IPRA recommended to SUSTAIN allegations that Officer B left his assigned job and district without authorization. IPRA recommended a twenty (20) day suspension for Officer A and a five (5) day suspension for Officer B.","0"
"1059519","The reporting party alleged that the accused entered and searched her mother's apartment without justification The accused damaged the front door lock in order to gain entry to the second floor apartment","1"
"1073463","The reporting party alleges, that without justification, the accused officers kicked in his door, and illegally entered and searched his home with their weapons drawn","1"
"1068619","The reporting party alleged that during separate investigations within a seven-year time frame, the accused officers fabricated evidence and altered files. It is further alleged that the accused officers made it appear that the victim who was 10 inches shorter and 100 pounds lighter than the other involved party (GEE was the aggressor during a physical altercation. The reporting party alleged that during separate investigations within a seven- years time frame, the accused officers fabricated evidence and altered files. It is further alleged that the accused officers made it appear that the victim: _. who was 10 inches shorter and 100 pounds lighter than the other involved party _-Nas the aggressor during a physical altercation. The reporting party alleged that during separate investigations within a seven-year time frame, the accused officers fabricated evidence and altered files. It is further alleged that the accused officers made it appear that the victim who was 10 inches shorter and 100 pounds lighter than the other involved party { vas the aggressor during a physical altercation. The reporting party alleged that during separate investigations within a seven-year time frame, the accused officers fabricated evidence and altered files. It is further alleged that the accused officers made it appear that the victim ( who was 10 inches shorter and 100 pounds lighter than the other involved party _ was the aggressor during a physical altercation. The reporting party alleged that during separate investigations within a seven-year time frame, the accused officers fabricated evidence and altered files. It is further alleged that the accused officers made it appear that the victim who was 10 inches shorter and 100 pounds lighter than the other involved party ._, was the aggressor during a physical altercation.   Page 1 of 3 CPD 0218247","0"
"1063460","Itis alleged by Sgt. Joseph Dickman #1805 that the accused, P.O. Kurrin Beamon #13629, received a written order -- Notice of Indebtedness form, referencing E01-07 on 02-JUN-2013 and failed to come into compliance within 30 days of being notified of her indebtedness to the City of Chicago.","0"
"1060599","ITIS REPORTED THAT THE ACCUSED OFFICER FAILED TO FOLLOW A DIRECT ORDER.","0"
"1061935","The complainant states that unknown Department members arrived at her home to arrest her daughter based upon a signed complaint from the neighbors. The complainant states she called 911 to request a supervisor on the scene. The complainant alleges that the accused officer that arrived refused to provide her witha battery report and asked her, """"What do you want me to do?"""" The complainant state~ “he -alled 114 because her daughter vas involved in an physical altercation with neighbors. The complainant alleges that the accused officers that arrived failed to arrest the offenders that remained on the scene.","1"
"1055826","The complainant alleges that the accused officers searched her residence without justification looking for a gun. The complainant alleges that the accused officers ransacked and damaged items throughout her residence. The complainant states she videotaped the incident.","1"
"1075826","Reporting Party alleges unidentified officers searched her apartment without a warrant or permission, damaging her personal property.","1"
"1050623","It is reported that this is an ongoing problem in which the Reporting Sergeant has approached said problem, with numerous and various methods of counseling and discipline with negative results. The accused officer was insubordinate and disrespectful towards the reporting party. It is reported that the accused officer disobeyed a direct order and impeded the Departments efforts to achieve its policy and goals. It is reported that the accused officer failed to wear her uniform and publicly criticized the actions of another Department Member.","0"
"1051477","The reporting party alleged that the accused responded to her call to the police after the reporting party's sister sprayed her with “mace"""" and attempted to Taser her. The reporting party alleged that the accused officers failed to provide police service in that they did not arrest an offender still on the scene.","0"
"1059645","The complainant who did not witness the incident alleges that the accused officers searched her residence without a warrant or permission.","1"
"1059811","officers entered her home without warrant or permission.","1"
"1060257","The complainant alleges that the accused officer failed to return or inventory his personal property and $1,200-. The complainant alleges that the accused officer failed to return or inventory his personal property and $1 ,200-.","0"
"1057378","[tis alleged by the complainant that on 27 Sep 2012 at 1157hrs, the accused P.C #11067 Employee MM, reported to the Random Drug Testing Unit to submit to random drug and urine testing. A urine specimen was collected and the accused was administered a Breath Analysis test. At that time it was observed that the accused had tested positive for breath alcohol which was above the threshold established by the Department. The accused was administered a Breath Analysis at 1157hrs which resulted in a reading of .129 BAC","0"
"1064243","The reporting party alleges that he drove to the 016th District police station to file a complaint on what had transpired, a male black officer failed to stop a drunk driver from getting back onto the road. The reporting party alleges that a white male uniformed supervisor failed to assist him. The reporting party alleges that the supervisor was rude and unprofessional and stated in an abrupt manner, """"I will take care of it, just leave.” The reporting party alleges that he observed a car driving erratically in traffic and he flagged down a marked vehicle. The reporting party alleges that he pointed out the vehicle and informed the black male uniformed officer that vehicle was weaving in and out of traffic and that he driver could have caused an accident. The reporting party alleges that the officer drove away north bound on","0"
"1049027","The reporting party alleges that the accused and his partner a ma’ Hispanic uniformed officer, possibly, one possibly named """"Floresé issued him several false traffic citations. The reporting party further that the Hispanic unformed officer, possibly named """"Flores"""" instructed the accused to write the tickets and that he stated to him, """"I don't like Arabian People."""" The reporting party alleges that officer, possibly named """"Flores” asked for his cell number and stated """"How long will take you to get me a gun, if you don't | will lock you up."""" The reporting party alleges that the officer, possibly named Flores texted him a message frorr stating, """"Where's my gift?","0"
"1055056","The reporting party alleged that accused entered and searched her residence without justification. One of the officers stated, “Bitch call the police” and refused to give their names and star numbers upon request. The reporting party stated that her husband, was arrested for Unlawiul Use of Weapon","1"
"1009478","On September 21, 2007, a complaint was registered with the Independent Police Review Authority (IPRA), regarding an incident occurring in the 2nd District on September 21, 2007, involving two Chicago Police Department (CPD) officers (Officers A and B), and two high school students (Victims 1 and 2). It was alleged that Officer A, who was on duty, slapped Victim 1 on the face; grabbed Victim 1 by the neck; failed to complete a Tactical Response Report (TRR) for Victim 1; directed profanities during the incident; and grabbed Victim 2 by the neck and choked him. It was further alleged that Officer B, who was off duty and working as a security supervisor at the school, grabbed Victim 2s arm; and threatened to break Victim 2s arm. Based on statements from the accused officers, reports, photographs, and witnesses, IPRA recommended to SUSTAIN the allegations that Officer A slapped Victim 1 on the face; grabbed Victim 1 by the neck; failed to complete a TRR for Victim 1; used profanities during the incident; and grabbed Victim 2 by the neck and choked him. Further, IPRA recommended a finding of EXONERATED for the allegation that Officer B grabbed Victim 2s arm. Further, IPRA recommended a finding of NOT SUSTAINED for the allegation that Officer B threatened to break Victim 2s arm. IPRA recommended a five (5) day suspension for Officer A.","0"
"1048888","In an incident involving three on-duty CPD Officers (Officer A, B, and C), an Unknown on-duty CPD officer, a Complainant/Victim (Complainant/Victim 1), and another Victim (Victim 2); it was alleged that, while conducting a traffic stop, Officer A threatened, pushed, and stripped searched Victim 2 in public without proper authorization and improperly used Complainant/Victim 1s vehicle. It is also alleged that Officers B and C stripped searched Victim 2 in public without proper authorization and improperly used Complainant/Victim 1s vehicle. It is further alleged that an Unknown Officer stripped searched the Complainant/Victim 1 without proper authorization or justification.","0"
"1054610","Itis alleged by the complainant attorney| MMMl -t o~ 31 July 2010, at N - =ccuscd department members entered o residence of his client ISR ot 2 vad search warrant. Itis alleged by the complainant attorney that on 31 July 2010, at _ theaccised denartment members entered the residence of his client vithout a valid search warrant Itis alleged by the complainant attorney Sthaton31 July 2010, at the acousea aepartment members entered the residence of his client without a valid search warrant Itis alleged by the complainant attorney Sthaton31 July 2010, 2t EEEESEGGGNG e accused department members entered the residence of his client without a valid search warrant.","1"
"1068542","ictim related that the ‘and the subject, reatened to kick each other's . The reporting party/victim alleged that the accused officers arrested without justification and misused their authority by failing to arrest ecause her daughter's husband is an officer assigned to the 7th District. The reporting party/victim further alleged that the white male accused officer was """"rude"""" because he would not tell her what charged with and would not talk porting party/victim. The victim","0"
"1054063","The complainant alleges that the accused officers searched her residence without justification","1"
"1057153","The complainant alleges that the accused officers searched his residence without a search warrant and ransacked and damaged items throughout his residence.","1"
"1058174","The reporting party victim alleged that on 03 November 2012 at approximately 1530 hours at the location several unknown uniformed and plain clothed officers searched her residence without justification","1"
"1053150","The complainant alleged that six uniformed officers entered and searched her house without justification and/or a warrant.","1"
"1052171","The reporting party alleged that the accused failed to conduct a thorough investigation regarding her son being shot in front of a survellance camera. The accused refused to get the tapes and failed to return her telephone calls. CASE REPORT: Aggravated Battery RD HV","0"
"1067709","THE REPORTING PARTY ALLEGES THAT THE ACCUSED OFFICER ENTERED AND SEARCHED HER RESIDENCE WITHOUT JUSTIFICATION. THE REPORTING PARTY ALLEGES THAT THE ACCUSED OFFICERS ENTERED AND SEARCHED HER RESIDENCE WITHOUT JUSTIFICATION.","1"
"1052159","The complainant states that while she was inside the restaurant, an unknown male subject said, """"Fuck the police!"""" as a marked vehicle drove by. The complainant states that the unknown department member did a u-turn and came inside. The complainant alleges that the accused officer pushed her stroller over causing her baby to almost fall out. The complainant alleges that if she did not catch her baby, he/she would have fallen out of the stroller. The complainant asked the accused officer if she could leave and he replied, """"Shut the fuck up.” When the complainant requested his badge number, the accused officer replied, “Fuck you,” and put his badge in his car.","0"
"1057161","The complainant alleged that the accused officer entered and searched the victims’ home without a warrant or permission.","1"
"1055051","It is alleged that the accused officer entered the Complainant's apartment without a warrant It is alleged that the accused officer entered the Complainant's apartment without a warrant.","1"
"1060064","named or inventory","0"
"1086932","Complainant, Mr. _(herein referred to as _was interviewed by the Independent Police Review Authority (IPRA) on October 6, 2017. _eXpressed that two officers, Officer _and Officer _entered his home without cause. - stated that he was not home during the time of this incident; however, his housemates3 were present. According to _his house is under foreclosure and his neighbors have called the police in the past to complain about their occupancy. On September 26, 2017, the officers opened the storm door and entered the home without permission. On September 26, 2017 at approximately 11:39 pm Officers _and _were dispatched to _for a noise complaint. When they arrived, the officers knocked and observed a group of individuals playing video games and listening to loud music. Officer - and Officer _asked the individuals to turn down the music and the individuals complied. The individuals were able to provide identification and proof that they resided in the home. The officers reported no observations of any illegal activities in the home. Of?cer _observed ?an empty house with a TV and couch.? Officer _and Officer _did not issue any citations and closed the event reporting no issues. Officer _and Officer _denied searching the home. Officers stated during interviews with COPA, if they entered in the home, it was only a couple steps into the to check identification of the individuals.","1"
"1057439","The complainant, called the police while at the nursing home where she was speaking with a resident whom she believed to have robbed her children at gunpoint earlier in the day. It is alleged that when the officers arrived they were rude and unprofessional in that they did not listen to her and told her there was nothing they could do because her children were not with her to file a report. It is alleged that the Sergeant told her that she needed to leave the premises and threatened to lock her up if she did not leave. The Sergeant also used profanities and stated, """"l don't give a fuck.” Itis also alleged that the Sergeant told her he would meet her at her residence, but did not show up.","0"
"1056883","——_ Tha pamntane + alleges on 06 SEP 2012 at eer ~~ 2 approximately 1800-1830 hours several unidentified police officers damaged her apartment. The complainant lleges on 06 SEP 2012 at and at approximately 1800-1830 hours several unidentified police officers searched her apartment without justification or warrant. The complainant] alleges on 06 SEP 2012 at _ —:; 1800-1830 hours several unidentified police officers damaged her apartment The complainant] alleges on 06 SEP 2012 at —— 1800-1830 hours several unidentified police officers searched her apartment without justification or warrant. The complainant alleges on 06 SEP 2012 at and at approximately 1800-1830 hours several unidentified police officers damaged her apartment The complainant alleges on 06 SEP 2012 at wal floor and at approximately 1800-1830 hours several unidentified police officers searched her apartment without justification or warrant. The complainant alleges on 08 SEP 2012 at, - and at approximately 1800-1830 hours several unidentified police officers damaged her apartment The complainant leges on 06 SEP 2012 at 6201 S. Whipple, 2nd floor ana at approximately 1800-1830 hours several unidentified police officers searched her apartment without justification or warrant. The complainant alleges on 06 SEP 2012 at 6201 S. Whipple, 2nd fl00. wins us ayyrvan ately 1800-1830 hours several unidentified police officers damaged her apartment The complainant ~~ lleges on 06 SEP 2012 at Whipple, 2nd floor ana at approximately 1800-1830 hours several unidentified police officers searched her apartment without justification or warrant. The complainant] jalleges on 06 SEP 2012 at _ ee 41800-1830 hours several unidentified police officers damaged her apartment The complainant alleges on 06 SEP 2012 at ‘and at approximately 1800-1830 hours seve,a: unidentified police officers searched her apartment without justification or warrant, The complainant Kimberly BURNS alleges on 06 SEP 2012 at and at approximately 1800-1830 hours several unidentified police officers damaged her apartment The complainant alleges on 06 SEP 2012 aff ind at approximately 1800-1830 hours several unidentified police officers searched her apartment without justification or warrant.","1"
"1060850","identification card.","0"
"1069157","The reporting party alleged that the accused officers entered and searched his residence without justification. It is alleged that the accused officers threw a large sum of money at him and then made false accusations that he was selling drugs in his front yard.","1"
